{
  "profile_version": "1.0.0",
  "profile_id": "3f2c1a90-6d4e-4b1a-9c8f-0a1b2c3d4e5f",
  "created_at": "2026-09-08T09:00:00+08:00",
  "updated_at": "2026-09-08T09:22:00+08:00",
  "answers": {
    "founder": {
      "full_name": "Amirah B.",
      "age": 24,
      "citizenship": "SG",
      "is_key_applicant": true,
      "first_time_founder": true,
      "previously_incorporated": false,
      "equity_pct": 100,
      "access_needs": [
        "SCREEN_READER",
        "PLAIN_LANGUAGE"
      ],
      "residing_in_sg": true
    },
    "venture": {
      "name": "Quiet Hours",
      "one_liner": "A cafe staffed and run by deaf and hard-of-hearing baristas.",
      "problem_statement": "Deaf youth in Singapore face limited entry-level hospitality roles.",
      "stage": "PROTOTYPE",
      "incorporated": false,
      "uen": null,
      "incorporation_date": null,
      "entity_type": null,
      "entity_status": null,
      "ssic_code": null,
      "project_duration_months": 6
    },
    "impact": {
      "beneficiary_group": "Deaf and hard-of-hearing youth aged 18-30",
      "beneficiary_count_est": 40,
      "impact_description": "Paid training and employment pathway into hospitality.",
      "beneficiary_validation": true,
      "sso_partnership": false,
      "sso_partner_name": null
    },
    "memberships": {
      "raise_member": false,
      "raise_member_since": null,
      "amp_relationship": "IN_DISCUSSION",
      "amp_name": "SMU IIE"
    },
    "funding": {
      "amount_sought_sgd": 50000,
      "other_govt_funding": false,
      "other_govt_funding_detail": null,
      "can_match_capital_sgd": 0
    },
    "readiness": {
      "has_pitch_deck": false,
      "has_acra_profile": false,
      "has_management_accounts": false,
      "has_financial_projections": false,
      "has_team_resumes": true,
      "team_size": 2
    }
  },
  "field_meta": {
    "founder.age": {
      "source": "FOUNDER",
      "confirmed_by_founder": true,
      "updated_at": "2026-09-08T09:02:00+08:00"
    },
    "venture.one_liner": {
      "source": "AI_EXTRACTED",
      "confirmed_by_founder": true,
      "updated_at": "2026-09-08T09:10:00+08:00",
      "note": "Summarised from what you told us."
    },
    "impact.beneficiary_count_est": {
      "source": "AI_ESTIMATED",
      "confirmed_by_founder": false,
      "updated_at": "2026-09-08T09:12:00+08:00",
      "note": "We estimated this. Confirm before you submit."
    }
  },
  "stage_progress": [
    {
      "grant_id": "raise-vfg-youth",
      "stage_id": "stage_1_submit",
      "status": "IN_PROGRESS",
      "updated_at": "2026-09-08T09:22:00+08:00"
    }
  ],
  "elicit_progress": {
    "completed_step_ids": [
      "who_you_are",
      "citizenship",
      "access_needs",
      "venture_idea",
      "who_it_helps"
    ],
    "current_step_id": "venture_stage"
  }
}
